{
  "schemaVersion": 1,
  "artifactType": "GERMAN_BASISSCHRIFT_HISTORICAL_GAP_FINAL_ADJUDICATION",
  "phase": "15.5B5.3",
  "profile": "de-basisschrift",
  "sourceAudit": {
    "phase": "15.5B5.3J",
    "auditorScriptSha256": "57B5C5F5A33E2E659A49A9628E700BF3F8FA5BA2049C2259E7FAF3BD5FF57DC6",
    "modelCanonicalSha256": "4244BDB66160A6D158C539AD037E0CD8F22C7900FA9751EB1B51ADC13F021224",
    "jsonByteSha256": "E615B500C93CE033E6C1182B1550D881E597670A739C80C58D0AFFB5B2FEE94C"
  },
  "baseline": {
    "repositoryCommit": "19455e5f55985a5d135ec0809606b859625aff2c"
  },
  "loweringTraceabilityUniverse": {
    "total": 123,
    "historicalFixtureGradeCovered": 22,
    "historicalEvidenceGap": 52,
    "newEvidenceRequired": 49
  },
  "historicalGapFinalAdjudication": {
    "rules": 52,
    "counts": {
      "EXPECTED_BRAILLE_OUTPUT_EVIDENCE_REQUIRED": 6,
      "HISTORICAL_CASE_PAYLOAD_RECONSTRUCTION_REQUIRED": 45,
      "RULE_SOURCE_PROVEN_COMPLETE_VECTOR_DERIVED_HISTORICAL_CASE_CANONICAL_SOURCE_UNRESOLVED": 1
    },
    "fixturePromotions": 0,
    "records": [
      {
        "ruleId": "DE-CASE-002",
        "historicalValidationCaseIds": [
          "DE-CASE-CASE-003"
        ],
        "sourceIdentityClass": "HAS_DERIVED_COMPLETE_VECTOR_CONTAINER_ASSOCIATION",
        "priorPromotionFeasibility": "MANUAL_COMPLETE_VECTOR_PROVENANCE_ADJUDICATION_REQUIRED",
        "finalHistoricalGapClass": "RULE_SOURCE_PROVEN_COMPLETE_VECTOR_DERIVED_HISTORICAL_CASE_CANONICAL_SOURCE_UNRESOLVED",
        "requiredNewEvidence": [
          "CANONICAL_HISTORICAL_CASE_SOURCE_IDENTITY"
        ],
        "fixtureGradeProven": false,
        "automaticPromotionEligible": false,
        "runtimeConformanceProven": false
      },
      {
        "ruleId": "DE-CB-004",
        "historicalValidationCaseIds": [
          "DE-CB-CASE-001"
        ],
        "sourceIdentityClass": "REFERENCE_LABELS_WITHOUT_RECOVERED_PAYLOAD_SOURCE",
        "priorPromotionFeasibility": "HISTORICAL_CASE_PAYLOAD_RECONSTRUCTION_REQUIRED",
        "finalHistoricalGapClass": "HISTORICAL_CASE_PAYLOAD_RECONSTRUCTION_REQUIRED",
        "requiredNewEvidence": [
          "INPUT_PAYLOAD",
          "EXPECTED_BRAILLE_OUTPUT",
          "CANONICAL_HISTORICAL_CASE_SOURCE_IDENTITY"
        ],
        "fixtureGradeProven": false,
        "automaticPromotionEligible": false,
        "runtimeConformanceProven": false
      },
      {
        "ruleId": "DE-CB-005",
        "historicalValidationCaseIds": [
          "DE-CB-CASE-002"
        ],
        "sourceIdentityClass": "REFERENCE_LABELS_WITHOUT_RECOVERED_PAYLOAD_SOURCE",
        "priorPromotionFeasibility": "HISTORICAL_CASE_PAYLOAD_RECONSTRUCTION_REQUIRED",
        "finalHistoricalGapClass": "HISTORICAL_CASE_PAYLOAD_RECONSTRUCTION_REQUIRED",
        "requiredNewEvidence": [
          "INPUT_PAYLOAD",
          "EXPECTED_BRAILLE_OUTPUT",
          "CANONICAL_HISTORICAL_CASE_SOURCE_IDENTITY"
        ],
        "fixtureGradeProven": false,
        "automaticPromotionEligible": false,
        "runtimeConformanceProven": false
      },
      {
        "ruleId": "DE-CB-006",
        "historicalValidationCaseIds": [
          "DE-CB-CASE-003"
        ],
        "sourceIdentityClass": "REFERENCE_LABELS_WITHOUT_RECOVERED_PAYLOAD_SOURCE",
        "priorPromotionFeasibility": "HISTORICAL_CASE_PAYLOAD_RECONSTRUCTION_REQUIRED",
        "finalHistoricalGapClass": "HISTORICAL_CASE_PAYLOAD_RECONSTRUCTION_REQUIRED",
        "requiredNewEvidence": [
          "INPUT_PAYLOAD",
          "EXPECTED_BRAILLE_OUTPUT",
          "CANONICAL_HISTORICAL_CASE_SOURCE_IDENTITY"
        ],
        "fixtureGradeProven": false,
        "automaticPromotionEligible": false,
        "runtimeConformanceProven": false
      },
      {
        "ruleId": "DE-CB-007",
        "historicalValidationCaseIds": [
          "DE-CB-CASE-004"
        ],
        "sourceIdentityClass": "REFERENCE_LABELS_WITHOUT_RECOVERED_PAYLOAD_SOURCE",
        "priorPromotionFeasibility": "HISTORICAL_CASE_PAYLOAD_RECONSTRUCTION_REQUIRED",
        "finalHistoricalGapClass": "HISTORICAL_CASE_PAYLOAD_RECONSTRUCTION_REQUIRED",
        "requiredNewEvidence": [
          "INPUT_PAYLOAD",
          "EXPECTED_BRAILLE_OUTPUT",
          "CANONICAL_HISTORICAL_CASE_SOURCE_IDENTITY"
        ],
        "fixtureGradeProven": false,
        "automaticPromotionEligible": false,
        "runtimeConformanceProven": false
      },
      {
        "ruleId": "DE-CB-008",
        "historicalValidationCaseIds": [
          "DE-CB-CASE-006",
          "DE-CB-CASE-007",
          "DE-CB-CASE-008"
        ],
        "sourceIdentityClass": "REFERENCE_LABELS_WITHOUT_RECOVERED_PAYLOAD_SOURCE",
        "priorPromotionFeasibility": "HISTORICAL_CASE_PAYLOAD_RECONSTRUCTION_REQUIRED",
        "finalHistoricalGapClass": "HISTORICAL_CASE_PAYLOAD_RECONSTRUCTION_REQUIRED",
        "requiredNewEvidence": [
          "INPUT_PAYLOAD",
          "EXPECTED_BRAILLE_OUTPUT",
          "CANONICAL_HISTORICAL_CASE_SOURCE_IDENTITY"
        ],
        "fixtureGradeProven": false,
        "automaticPromotionEligible": false,
        "runtimeConformanceProven": false
      },
      {
        "ruleId": "DE-CB-009",
        "historicalValidationCaseIds": [
          "DE-CB-CASE-009"
        ],
        "sourceIdentityClass": "REFERENCE_LABELS_WITHOUT_RECOVERED_PAYLOAD_SOURCE",
        "priorPromotionFeasibility": "HISTORICAL_CASE_PAYLOAD_RECONSTRUCTION_REQUIRED",
        "finalHistoricalGapClass": "HISTORICAL_CASE_PAYLOAD_RECONSTRUCTION_REQUIRED",
        "requiredNewEvidence": [
          "INPUT_PAYLOAD",
          "EXPECTED_BRAILLE_OUTPUT",
          "CANONICAL_HISTORICAL_CASE_SOURCE_IDENTITY"
        ],
        "fixtureGradeProven": false,
        "automaticPromotionEligible": false,
        "runtimeConformanceProven": false
      },
      {
        "ruleId": "DE-CB-010",
        "historicalValidationCaseIds": [
          "DE-CB-CASE-010",
          "DE-CB-CASE-011"
        ],
        "sourceIdentityClass": "REFERENCE_LABELS_WITHOUT_RECOVERED_PAYLOAD_SOURCE",
        "priorPromotionFeasibility": "HISTORICAL_CASE_PAYLOAD_RECONSTRUCTION_REQUIRED",
        "finalHistoricalGapClass": "HISTORICAL_CASE_PAYLOAD_RECONSTRUCTION_REQUIRED",
        "requiredNewEvidence": [
          "INPUT_PAYLOAD",
          "EXPECTED_BRAILLE_OUTPUT",
          "CANONICAL_HISTORICAL_CASE_SOURCE_IDENTITY"
        ],
        "fixtureGradeProven": false,
        "automaticPromotionEligible": false,
        "runtimeConformanceProven": false
      },
      {
        "ruleId": "DE-CB-011",
        "historicalValidationCaseIds": [
          "DE-CB-CASE-005",
          "DE-CB-CASE-011"
        ],
        "sourceIdentityClass": "REFERENCE_LABELS_WITHOUT_RECOVERED_PAYLOAD_SOURCE",
        "priorPromotionFeasibility": "HISTORICAL_CASE_PAYLOAD_RECONSTRUCTION_REQUIRED",
        "finalHistoricalGapClass": "HISTORICAL_CASE_PAYLOAD_RECONSTRUCTION_REQUIRED",
        "requiredNewEvidence": [
          "INPUT_PAYLOAD",
          "EXPECTED_BRAILLE_OUTPUT",
          "CANONICAL_HISTORICAL_CASE_SOURCE_IDENTITY"
        ],
        "fixtureGradeProven": false,
        "automaticPromotionEligible": false,
        "runtimeConformanceProven": false
      },
      {
        "ruleId": "DE-CB-013",
        "historicalValidationCaseIds": [
          "DE-CB-CASE-012"
        ],
        "sourceIdentityClass": "REFERENCE_LABELS_WITHOUT_RECOVERED_PAYLOAD_SOURCE",
        "priorPromotionFeasibility": "HISTORICAL_CASE_PAYLOAD_RECONSTRUCTION_REQUIRED",
        "finalHistoricalGapClass": "HISTORICAL_CASE_PAYLOAD_RECONSTRUCTION_REQUIRED",
        "requiredNewEvidence": [
          "INPUT_PAYLOAD",
          "EXPECTED_BRAILLE_OUTPUT",
          "CANONICAL_HISTORICAL_CASE_SOURCE_IDENTITY"
        ],
        "fixtureGradeProven": false,
        "automaticPromotionEligible": false,
        "runtimeConformanceProven": false
      },
      {
        "ruleId": "DE-CB-015",
        "historicalValidationCaseIds": [
          "DE-CB-CASE-013"
        ],
        "sourceIdentityClass": "REFERENCE_LABELS_WITHOUT_RECOVERED_PAYLOAD_SOURCE",
        "priorPromotionFeasibility": "HISTORICAL_CASE_PAYLOAD_RECONSTRUCTION_REQUIRED",
        "finalHistoricalGapClass": "HISTORICAL_CASE_PAYLOAD_RECONSTRUCTION_REQUIRED",
        "requiredNewEvidence": [
          "INPUT_PAYLOAD",
          "EXPECTED_BRAILLE_OUTPUT",
          "CANONICAL_HISTORICAL_CASE_SOURCE_IDENTITY"
        ],
        "fixtureGradeProven": false,
        "automaticPromotionEligible": false,
        "runtimeConformanceProven": false
      },
      {
        "ruleId": "DE-CB-016",
        "historicalValidationCaseIds": [
          "DE-CB-CASE-014"
        ],
        "sourceIdentityClass": "REFERENCE_LABELS_WITHOUT_RECOVERED_PAYLOAD_SOURCE",
        "priorPromotionFeasibility": "HISTORICAL_CASE_PAYLOAD_RECONSTRUCTION_REQUIRED",
        "finalHistoricalGapClass": "HISTORICAL_CASE_PAYLOAD_RECONSTRUCTION_REQUIRED",
        "requiredNewEvidence": [
          "INPUT_PAYLOAD",
          "EXPECTED_BRAILLE_OUTPUT",
          "CANONICAL_HISTORICAL_CASE_SOURCE_IDENTITY"
        ],
        "fixtureGradeProven": false,
        "automaticPromotionEligible": false,
        "runtimeConformanceProven": false
      },
      {
        "ruleId": "DE-EMPH-002",
        "historicalValidationCaseIds": [
          "DE-EMPH-CASE-001"
        ],
        "sourceIdentityClass": "REFERENCE_LABELS_WITHOUT_RECOVERED_PAYLOAD_SOURCE",
        "priorPromotionFeasibility": "HISTORICAL_CASE_PAYLOAD_RECONSTRUCTION_REQUIRED",
        "finalHistoricalGapClass": "HISTORICAL_CASE_PAYLOAD_RECONSTRUCTION_REQUIRED",
        "requiredNewEvidence": [
          "INPUT_PAYLOAD",
          "EXPECTED_BRAILLE_OUTPUT",
          "CANONICAL_HISTORICAL_CASE_SOURCE_IDENTITY"
        ],
        "fixtureGradeProven": false,
        "automaticPromotionEligible": false,
        "runtimeConformanceProven": false
      },
      {
        "ruleId": "DE-EMPH-004",
        "historicalValidationCaseIds": [